Terminal phase of malignant skin melanoma,"Terminal phase, with medication (for cancers, end-stage kidney/liver disease)","has lost a lot of weight and regularly uses strong medication to avoid constant pain. The person has no appetite, feels nauseous, and needs to spend most of the day in bed.",0.5395604918999996,0.37669583250000005,0.6870952699999999
Controlled phase of malignant skin melanoma,Generic uncomplicated disease: worry and daily medication,has a chronic disease that requires medication every day and causes some worry but minimal interference with daily activities.,0.049011415,0.031121342499999996,0.072092547
Mild disfigurement due to squamous cell carcinoma,"Disfigurement, level 1","has a slight, visible physical deformity that others notice, which causes some worry and discomfort.",0.011016252399999999,0.005239763,0.020619542499999997
Moderate disfigurement due to squamous cell carcinoma,"Disfigurement, level 2","has a visible physical deformity that causes others to stare and comment. As a result, the person is worried and has trouble sleeping and concentrating.",0.066991754,0.04441772,0.095900522
Severe disfigurement due to squamous cell carcinoma,"Disfigurement, level 3, with itch/pain","has an obvious physical deformity that is very painful and itchy. The physical deformity makes others uncomfortable, which causes the person to avoid social contact, feel worried, sleep poorly, and think about suicide.",0.5763168282000003,0.40142909250000003,0.7307553099999999
Disfigurement due to basal cell carcinoma,"Disfigurement, level 1","has a slight, visible physical deformity that others notice, which causes some worry and discomfort.",0.011016252399999999,0.005239763,0.020619542499999997
Basal cell carcinoma without disfigurement,Asymptomatic,,0,0,0
Diagnosis and primary therapy phase of soft tissue and other extraosseous sarcomas,"Cancer, diagnosis and primary therapy ","has pain, nausea, fatigue, weight loss and high anxiety.",0.28750118010000075,0.19259089000000001,0.39893967
Metastatic phase of soft tissue and other extraosseous sarcomas,"Cancer, metastatic","has severe pain, extreme fatigue, weight loss and high anxiety.",0.45136111720000033,0.30716694,0.600299833
Terminal phase of soft tissue and other extraosseous sarcomas,"Terminal phase, with medication (for cancers, end-stage kidney/liver disease)","has lost a lot of weight and regularly uses strong medication to avoid constant pain. The person has no appetite, feels nauseous, and needs to spend most of the day in bed.",0.5395604918999996,0.37669583250000005,0.6870952699999999
Controlled phase of soft tissue and other extraosseous sarcomas,Generic uncomplicated disease: worry and daily medication,has a chronic disease that requires medication every day and causes some worry but minimal interference with daily activities.,0.049011415,0.031121342499999996,0.072092547
Diagnosis and primary therapy phase of malignant bone tumors,"Cancer, diagnosis and primary therapy ","has pain, nausea, fatigue, weight loss and high anxiety.",0.28750118010000075,0.19259089000000001,0.39893967
Metastatic phase of malignant bone tumors,"Cancer, metastatic","has severe pain, extreme fatigue, weight loss and high anxiety.",0.45136111720000033,0.30716694,0.600299833
Terminal phase of malignant bone tumors,"Terminal phase, with medication (for cancers, end-stage kidney/liver disease)","has lost a lot of weight and regularly uses strong medication to avoid constant pain. The person has no appetite, feels nauseous, and needs to spend most of the day in bed.",0.5395604918999996,0.37669583250000005,0.6870952699999999
Controlled phase of malignant bone tumors,Generic uncomplicated disease: worry and daily medication,has a chronic disease that requires medication every day and causes some worry but minimal interference with daily activities.,0.049011415,0.031121342499999996,0.072092547
Diagnosis and primary therapy phase of breast cancer,"Cancer, diagnosis and primary therapy ","has pain, nausea, fatigue, weight loss and high anxiety.",0.28750118010000075,0.19259089000000001,0.39893967
Metastatic phase of breast cancer,"Cancer, metastatic","has severe pain, extreme fatigue, weight loss and high anxiety.",0.45136111720000033,0.30716694,0.600299833
"Mastectomy from breast cancer, beyond 10 years",Mastectomy,had one of her breasts removed and sometimes has pain or swelling in the arms. ,0.035575112,0.020313505000000003,0.056776485
Terminal phase of breast cancer,"Terminal phase, with medication (for cancers, end-stage kidney/liver disease)","has lost a lot of weight and regularly uses strong medication to avoid constant pain. The person has no appetite, feels nauseous, and needs to spend most of the day in bed.",0.5395604918999996,0.37669583250000005,0.6870952699999999
"Controlled phase of breast cancer, without mastectomy",Generic uncomplicated disease: worry and daily medication,has a chronic disease that requires medication every day and causes some worry but minimal interference with daily activities.,0.049011415,0.031121342499999996,0.072092547
"Controlled phase of breast cancer, with mastectomy",Mastectomy and generic medication,(combined DW),0.082760723,0.051866644,0.12394512669789075
Diagnosis and primary therapy phase of cervical cancer,"Cancer, diagnosis and primary therapy ","has pain, nausea, fatigue, weight loss and high anxiety.",0.28750118010000075,0.19259089000000001,0.39893967
Metastatic phase of cervical cancer,"Cancer, metastatic","has severe pain, extreme fatigue, weight loss and high anxiety.",0.45136111720000033,0.30716694,0.600299833
Terminal phase of cervical cancer,"Terminal phase, with medication (for cancers, end-stage kidney/liver disease)","has lost a lot of weight and regularly uses strong medication to avoid constant pain. The person has no appetite, feels nauseous, and needs to spend most of the day in bed.",0.5395604918999996,0.37669583250000005,0.6870952699999999
Controlled phase of cervical cancer,Generic uncomplicated disease: worry and daily medication,has a chronic disease that requires medication every day and causes some worry but minimal interference with daily activities.,0.049011415,0.031121342499999996,0.072092547
Diagnosis and primary therapy phase of uterine cancer,"Cancer, diagnosis and primary therapy ","has pain, nausea, fatigue, weight loss and high anxiety.",0.28750118010000075,0.19259089000000001,0.39893967
Metastatic phase of uterine cancer,"Cancer, metastatic","has severe pain, extreme fatigue, weight loss and high anxiety.",0.45136111720000033,0.30716694,0.600299833
Terminal phase of uterine cancer,"Terminal phase, with medication (for cancers, end-stage kidney/liver disease)","has lost a lot of weight and regularly uses strong medication to avoid constant pain. The person has no appetite, feels nauseous, and needs to spend most of the day in bed.",0.5395604918999996,0.37669583250000005,0.6870952699999999
Controlled phase of uterine cancer,Generic uncomplicated disease: worry and daily medication,has a chronic disease that requires medication every day and causes some worry but minimal interference with daily activities.,0.049011415,0.031121342499999996,0.072092547
Diagnosis and primary therapy phase of ovarian cancer,"Cancer, diagnosis and primary therapy ","has pain, nausea, fatigue, weight loss and high anxiety.",0.28750118010000075,0.19259089000000001,0.39893967
Metastatic phase of ovarian cancer,"Cancer, metastatic","has severe pain, extreme fatigue, weight loss and high anxiety.",0.45136111720000033,0.30716694,0.600299833
Terminal phase of ovarian cancer,"Terminal phase, with medication (for cancers, end-stage kidney/liver disease)","has lost a lot of weight and regularly uses strong medication to avoid constant pain. The person has no appetite, feels nauseous, and needs to spend most of the day in bed.",0.5395604918999996,0.37669583250000005,0.6870952699999999
Controlled phase of ovarian cancer,Generic uncomplicated disease: worry and daily medication,has a chronic disease that requires medication every day and causes some worry but minimal interference with daily activities.,0.049011415,0.031121342499999996,0.072092547
Diagnosis and primary therapy phase of prostate cancer,"Cancer, diagnosis and primary therapy ","has pain, nausea, fatigue, weight loss and high anxiety.",0.28750118010000075,0.19259089000000001,0.39893967
Metastatic phase of prostate cancer,"Cancer, metastatic","has severe pain, extreme fatigue, weight loss and high anxiety.",0.45136111720000033,0.30716694,0.600299833
Terminal phase of prostate cancer,"Terminal phase, with medication (for cancers, end-stage kidney/liver disease)","has lost a lot of weight and regularly uses strong medication to avoid constant pain. The person has no appetite, feels nauseous, and needs to spend most of the day in bed.",0.5395604918999996,0.37669583250000005,0.6870952699999999
"Controlled phase of prostate cancer, without impotence or incontinence",Generic uncomplicated disease: worry and daily medication,has a chronic disease that requires medication every day and causes some worry but minimal interference with daily activities.,0.049011415,0.031121342499999996,0.072092547
"Controlled phase of prostate cancer, with impotence",Impotence and generic medication,(combined DW),0.06545319,0.040391078454069994,0.099544407
"Controlled phase of prostate cancer, with incontinence",Incontinence and generic medication,(combined DW),0.18113356032772826,0.12359102869968626,0.24808354277509775
"Incontinence from prostate cancer, beyond 10 years",Urinary incontinence,cannot control urinating.,0.13913545870000002,0.094181123,0.19754553749999998
"Impotence from prostate cancer, beyond 10 years",Impotence,has difficulty in obtaining or maintaining an erection.,0.017338897,0.008892265,0.03032386
Diagnosis and primary therapy phase of testicular cancer,"Cancer, diagnosis and primary therapy ","has pain, nausea, fatigue, weight loss and high anxiety.",0.28750118010000075,0.19259089000000001,0.39893967
Metastatic phase of testicular cancer,"Cancer, metastatic","has severe pain, extreme fatigue, weight loss and high anxiety.",0.45136111720000033,0.30716694,0.600299833
Terminal phase of testicular cancer,"Terminal phase, with medication (for cancers, end-stage kidney/liver disease)","has lost a lot of weight and regularly uses strong medication to avoid constant pain. The person has no appetite, feels nauseous, and needs to spend most of the day in bed.",0.5395604918999996,0.37669583250000005,0.6870952699999999
Controlled phase of testicular cancer,Generic uncomplicated disease: worry and daily medication,has a chronic disease that requires medication every day and causes some worry but minimal interference with daily activities.,0.049011415,0.031121342499999996,0.072092547
Diagnosis and primary therapy phase of kidney cancer,"Cancer, diagnosis and primary therapy ","has pain, nausea, fatigue, weight loss and high anxiety.",0.28750118010000075,0.19259089000000001,0.39893967
Metastatic phase of kidney cancer,"Cancer, metastatic","has severe pain, extreme fatigue, weight loss and high anxiety.",0.45136111720000033,0.30716694,0.600299833
Terminal phase of kidney cancer,"Terminal phase, with medication (for cancers, end-stage kidney/liver disease)","has lost a lot of weight and regularly uses strong medication to avoid constant pain. The person has no appetite, feels nauseous, and needs to spend most of the day in bed.",0.5395604918999996,0.37669583250000005,0.6870952699999999
Controlled phase of kidney cancer,Generic uncomplicated disease: worry and daily medication,has a chronic disease that requires medication every day and causes some worry but minimal interference with daily activities.,0.049011415,0.031121342499999996,0.072092547
Diagnosis and primary therapy phase of bladder cancer,"Cancer, diagnosis and primary therapy ","has pain, nausea, fatigue, weight loss and high anxiety.",0.28750118010000075,0.19259089000000001,0.39893967
Metastatic phase of bladder cancer,"Cancer, metastatic","has severe pain, extreme fatigue, weight loss and high anxiety.",0.45136111720000033,0.30716694,0.600299833
Terminal phase of bladder cancer,"Terminal phase, with medication (for cancers, end-stage kidney/liver disease)","has lost a lot of weight and regularly uses strong medication to avoid constant pain. The person has no appetite, feels nauseous, and needs to spend most of the day in bed.",0.5395604918999996,0.37669583250000005,0.6870952699999999
"Incontinence from bladder cancer, beyond 10 years",Urinary incontinence,cannot control urinating.,0.13913545870000002,0.094181123,0.19754553749999998
"Controlled phase of bladder cancer, without incontinence",Generic uncomplicated disease: worry and daily medication,has a chronic disease that requires medication every day and causes some worry but minimal interference with daily activities.,0.049011415,0.031121342499999996,0.072092547
"Controlled phase of bladder cancer, with incontinence",Incontinence and generic medication,(combined DW),0.18113356032772826,0.12359102869968626,0.24808354277509775
Diagnosis and primary therapy phase of brain and central nervous system cancers,"Cancer, diagnosis and primary therapy ","has pain, nausea, fatigue, weight loss and high anxiety.",0.28750118010000075,0.19259089000000001,0.39893967
Metastatic phase of brain and central nervous system cancers,"Cancer, metastatic","has severe pain, extreme fatigue, weight loss and high anxiety.",0.45136111720000033,0.30716694,0.600299833
Terminal phase of brain and central nervous system cancers,"Terminal phase, with medication (for cancers, end-stage kidney/liver disease)","has lost a lot of weight and regularly uses strong medication to avoid constant pain. The person has no appetite, feels nauseous, and needs to spend most of the day in bed.",0.5395604918999996,0.37669583250000005,0.6870952699999999
Controlled phase of brain and central nervous system cancers,Generic uncomplicated disease: worry and daily medication,has a chronic disease that requires medication every day and causes some worry but minimal interference with daily activities.,0.049011415,0.031121342499999996,0.072092547
Diagnosis and primary therapy phase of retinoblastoma,"Cancer, diagnosis and primary therapy ","has pain, nausea, fatigue, weight loss and high anxiety.",0.28750118010000075,0.19259089000000001,0.39893967
Metastatic phase of retinoblastoma,"Cancer, metastatic","has severe pain, extreme fatigue, weight loss and high anxiety.",0.45136111720000033,0.30716694,0.600299833
Terminal phase of retinoblastoma,"Terminal phase, with medication (for cancers, end-stage kidney/liver disease)","has lost a lot of weight and regularly uses strong medication to avoid constant pain. The person has no appetite, feels nauseous, and needs to spend most of the day in bed.",0.5395604918999996,0.37669583250000005,0.6870952699999999
Controlled phase of retinoblastoma,Generic uncomplicated disease: worry and daily medication,has a chronic disease that requires medication every day and causes some worry but minimal interference with daily activities.,0.049011415,0.031121342499999996,0.072092547
Diagnosis and primary therapy phase of other eye cancers,"Cancer, diagnosis and primary therapy ","has pain, nausea, fatigue, weight loss and high anxiety.",0.28750118010000075,0.19259089000000001,0.39893967
Metastatic phase of other eye cancers,"Cancer, metastatic","has severe pain, extreme fatigue, weight loss and high anxiety.",0.45136111720000033,0.30716694,0.600299833
Terminal phase of other eye cancers,"Terminal phase, with medication (for cancers, end-stage kidney/liver disease)","has lost a lot of weight and regularly uses strong medication to avoid constant pain. The person has no appetite, feels nauseous, and needs to spend most of the day in bed.",0.5395604918999996,0.37669583250000005,0.6870952699999999
Controlled phase of other eye cancers,Generic uncomplicated disease: worry and daily medication,has a chronic disease that requires medication every day and causes some worry but minimal interference with daily activities.,0.049011415,0.031121342499999996,0.072092547
Diagnosis and primary therapy phase of neuroblastoma and other peripheral nervous cell tumors,"Cancer, diagnosis and primary therapy ","has pain, nausea, fatigue, weight loss and high anxiety.",0.28750118010000075,0.19259089000000001,0.39893967
Metastatic phase of neuroblastoma and other peripheral nervous cell tumors,"Cancer, metastatic","has severe pain, extreme fatigue, weight loss and high anxiety.",0.45136111720000033,0.30716694,0.600299833
Terminal phase of neuroblastoma and other peripheral nervous cell tumors,"Terminal phase, with medication (for cancers, end-stage kidney/liver disease)","has lost a lot of weight and regularly uses strong medication to avoid constant pain. The person has no appetite, feels nauseous, and needs to spend most of the day in bed.",0.5395604918999996,0.37669583250000005,0.6870952699999999
Controlled phase of neuroblastoma and other peripheral nervous cell tumors,Generic uncomplicated disease: worry and daily medication,has a chronic disease that requires medication every day and causes some worry but minimal interference with daily activities.,0.049011415,0.031121342499999996,0.072092547
Diagnosis and primary therapy phase of thyroid cancer,"Cancer, diagnosis and primary therapy ","has pain, nausea, fatigue, weight loss and high anxiety.",0.28750118010000075,0.19259089000000001,0.39893967
Metastatic phase of thyroid cancer,"Cancer, metastatic","has severe pain, extreme fatigue, weight loss and high anxiety.",0.45136111720000033,0.30716694,0.600299833
Terminal phase of thyroid cancer,"Terminal phase, with medication (for cancers, end-stage kidney/liver disease)","has lost a lot of weight and regularly uses strong medication to avoid constant pain. The person has no appetite, feels nauseous, and needs to spend most of the day in bed.",0.5395604918999996,0.37669583250000005,0.6870952699999999
Controlled phase of thyroid cancer,Generic uncomplicated disease: worry and daily medication,has a chronic disease that requires medication every day and causes some worry but minimal interference with daily activities.,0.049011415,0.031121342499999996,0.072092547
Diagnosis and primary therapy phase of mesothelioma,"Cancer, diagnosis and primary therapy ","has pain, nausea, fatigue, weight loss and high anxiety.",0.28750118010000075,0.19259089000000001,0.39893967
Metastatic phase of mesothelioma,"Cancer, metastatic","has severe pain, extreme fatigue, weight loss and high anxiety.",0.45136111720000033,0.30716694,0.600299833
Terminal phase of mesothelioma,"Terminal phase, with medication (for cancers, end-stage kidney/liver disease)","has lost a lot of weight and regularly uses strong medication to avoid constant pain. The person has no appetite, feels nauseous, and needs to spend most of the day in bed.",0.5395604918999996,0.37669583250000005,0.6870952699999999
Controlled phase of mesothelioma,Generic uncomplicated disease: worry and daily medication,has a chronic disease that requires medication every day and causes some worry but minimal interference with daily activities.,0.049011415,0.031121342499999996,0.072092547
Diagnosis and primary therapy phase of Hodgkin disease,"Cancer, diagnosis and primary therapy ","has pain, nausea, fatigue, weight loss and high anxiety.",0.28750118010000075,0.19259089000000001,0.39893967
Metastatic phase of Hodgkin disease,"Cancer, metastatic","has severe pain, extreme fatigue, weight loss and high anxiety.",0.45136111720000033,0.30716694,0.600299833
Terminal phase of Hodgkin disease,"Terminal phase, with medication (for cancers, end-stage kidney/liver disease)","has lost a lot of weight and regularly uses strong medication to avoid constant pain. The person has no appetite, feels nauseous, and needs to spend most of the day in bed.",0.5395604918999996,0.37669583250000005,0.6870952699999999
Controlled phase of Hodgkin disease,Generic uncomplicated disease: worry and daily medication,has a chronic disease that requires medication every day and causes some worry but minimal interference with daily activities.,0.049011415,0.031121342499999996,0.072092547
Diagnosis and primary therapy phase of Burkitt lymphoma,"Cancer, diagnosis and primary therapy ","has pain, nausea, fatigue, weight loss and high anxiety.",0.28750118010000075,0.19259089000000001,0.39893967
Metastatic phase of Burkitt lymphoma,"Cancer, metastatic","has severe pain, extreme fatigue, weight loss and high anxiety.",0.45136111720000033,0.30716694,0.600299833
Terminal phase of Burkitt lymphoma,"Terminal phase, with medication (for cancers, end-stage kidney/liver disease)","has lost a lot of weight and regularly uses strong medication to avoid constant pain. The person has no appetite, feels nauseous, and needs to spend most of the day in bed.",0.5395604918999996,0.37669583250000005,0.6870952699999999
Controlled phase of Burkitt lymphoma,Generic uncomplicated disease: worry and daily medication,has a chronic disease that requires medication every day and causes some worry but minimal interference with daily activities.,0.049011415,0.031121342499999996,0.072092547
Diagnosis and primary therapy phase of other non-Hodgkin lymphoma,"Cancer, diagnosis and primary therapy ","has pain, nausea, fatigue, weight loss and high anxiety.",0.28750118010000075,0.19259089000000001,0.39893967
Metastatic phase of other non-Hodgkin lymphoma,"Cancer, metastatic","has severe pain, extreme fatigue, weight loss and high anxiety.",0.45136111720000033,0.30716694,0.600299833
Terminal phase of other non-Hodgkin lymphoma,"Terminal phase, with medication (for cancers, end-stage kidney/liver disease)","has lost a lot of weight and regularly uses strong medication to avoid constant pain. The person has no appetite, feels nauseous, and needs to spend most of the day in bed.",0.5395604918999996,0.37669583250000005,0.6870952699999999
Controlled phase of other non-Hodgkin lymphoma,Generic uncomplicated disease: worry and daily medication,has a chronic disease that requires medication every day and causes some worry but minimal interference with daily activities.,0.049011415,0.031121342499999996,0.072092547
Diagnosis and primary therapy phase of multiple myeloma,"Cancer, diagnosis and primary therapy ","has pain, nausea, fatigue, weight loss and high anxiety.",0.28750118010000075,0.19259089000000001,0.39893967
Metastatic phase of multiple myeloma,"Cancer, metastatic","has severe pain, extreme fatigue, weight loss and high anxiety.",0.45136111720000033,0.30716694,0.600299833
Terminal phase of multiple myeloma,"Terminal phase, with medication (for cancers, end-stage kidney/liver disease)","has lost a lot of weight and regularly uses strong medication to avoid constant pain. The person has no appetite, feels nauseous, and needs to spend most of the day in bed.",0.5395604918999996,0.37669583250000005,0.6870952699999999
Controlled phase of multiple myeloma,Generic uncomplicated disease: worry and daily medication,has a chronic disease that requires medication every day and causes some worry but minimal interference with daily activities.,0.049011415,0.031121342499999996,0.072092547
Diagnosis and primary therapy phase of acute lymphoid leukemia,"Cancer, diagnosis and primary therapy ","has pain, nausea, fatigue, weight loss and high anxiety.",0.28750118010000075,0.19259089000000001,0.39893967
Metastatic phase of acute lymphoid leukemia,"Cancer, metastatic","has severe pain, extreme fatigue, weight loss and high anxiety.",0.45136111720000033,0.30716694,0.600299833
Terminal phase of acute lymphoid leukemia,"Terminal phase, with medication (for cancers, end-stage kidney/liver disease)","has lost a lot of weight and regularly uses strong medication to avoid constant pain. The person has no appetite, feels nauseous, and needs to spend most of the day in bed.",0.5395604918999996,0.37669583250000005,0.6870952699999999
Controlled phase of acute lymphoid leukemia,Generic uncomplicated disease: worry and daily medication,has a chronic disease that requires medication every day and causes some worry but minimal interference with daily activities.,0.049011415,0.031121342499999996,0.072092547
Diagnosis and primary therapy phase of chronic lymphoid leukemia,"Cancer, diagnosis and primary therapy ","has pain, nausea, fatigue, weight loss and high anxiety.",0.28750118010000075,0.19259089000000001,0.39893967
Metastatic phase of chronic lymphoid leukemia,"Cancer, metastatic","has severe pain, extreme fatigue, weight loss and high anxiety.",0.45136111720000033,0.30716694,0.600299833
Terminal phase of chronic lymphoid leukemia,"Terminal phase, with medication (for cancers, end-stage kidney/liver disease)","has lost a lot of weight and regularly uses strong medication to avoid constant pain. The person has no appetite, feels nauseous, and needs to spend most of the day in bed.",0.5395604918999996,0.37669583250000005,0.6870952699999999
Controlled phase of chronic lymphoid leukemia,Generic uncomplicated disease: worry and daily medication,has a chronic disease that requires medication every day and causes some worry but minimal interference with daily activities.,0.049011415,0.031121342499999996,0.072092547
Diagnosis and primary therapy phase of acute myeloid leukemia,"Cancer, diagnosis and primary therapy ","has pain, nausea, fatigue, weight loss and high anxiety.",0.28750118010000075,0.19259089000000001,0.39893967
Metastatic phase of acute myeloid leukemia,"Cancer, metastatic","has severe pain, extreme fatigue, weight loss and high anxiety.",0.45136111720000033,0.30716694,0.600299833
