Sequela Name,Health State Name,Health State Lay Description,Mean,Lower,Upper
HIV/AIDS -  Drug-susceptible Tuberculosis without anemia,"Tuberculosis, HIV infected","has a persistent cough and fever, shortness of breath, night sweats, weakness and fatigue and severe weight loss.",0.4084592042999993,0.273578943,0.549464505
HIV/AIDS -  Drug-susceptible Tuberculosis with mild anemia,"Tuberculosis, HIV infected and anemia, mild",(combined DW),0.4106963603403607,0.27806277030604964,0.5506857393015835
HIV/AIDS -  Drug-susceptible Tuberculosis with moderate anemia,"Tuberculosis, HIV infected and anemia, moderate",(combined DW),0.43866320998543734,0.3065456732123501,0.5772493679484925
HIV/AIDS -  Drug-susceptible Tuberculosis with severe anemia,"Tuberculosis, HIV infected and anemia, severe",(combined DW),0.49482700365224924,0.352944567,0.6402024135809512
HIV/AIDS - Multidrug-resistant Tuberculosis without extensive drug resistance without anemia,"Tuberculosis, HIV infected","has a persistent cough and fever, shortness of breath, night sweats, weakness and fatigue and severe weight loss.",0.4084592042999993,0.273578943,0.549464505
HIV/AIDS - Multidrug-resistant Tuberculosis without extensive drug resistance with mild anemia,"Tuberculosis, HIV infected and anemia, mild",(combined DW),0.4106963603403607,0.27806277030604964,0.5506857393015835
HIV/AIDS - Multidrug-resistant Tuberculosis without extensive drug resistance with moderate anemia,"Tuberculosis, HIV infected and anemia, moderate",(combined DW),0.43866320998543734,0.3065456732123501,0.5772493679484925
HIV/AIDS - Multidrug-resistant Tuberculosis without extensive drug resistance with severe anemia,"Tuberculosis, HIV infected and anemia, severe",(combined DW),0.49482700365224924,0.352944567,0.6402024135809512
HIV/AIDS - Extensively drug-resistant Tuberculosis without anemia,"Tuberculosis, HIV infected","has a persistent cough and fever, shortness of breath, night sweats, weakness and fatigue and severe weight loss.",0.4084592042999993,0.273578943,0.549464505
HIV/AIDS - Extensively drug-resistant Tuberculosis with mild anemia,"Tuberculosis, HIV infected and anemia, mild",(combined DW),0.4106963603403607,0.27806277030604964,0.5506857393015835
HIV/AIDS - Extensively drug-resistant Tuberculosis with moderate anemia,"Tuberculosis, HIV infected and anemia, moderate",(combined DW),0.43866320998543734,0.3065456732123501,0.5772493679484925
HIV/AIDS - Extensively drug-resistant Tuberculosis with severe anemia,"Tuberculosis, HIV infected and anemia, severe",(combined DW),0.49482700365224924,0.352944567,0.6402024135809512
Symptomatic HIV without anemia,"HIV cases, symptomatic, pre-AIDS","has weight loss, fatigue, and frequent infections.",0.27447870490000065,0.18435854499999998,0.37709576250000004
AIDS without anemia,"AIDS cases, not receiving ARV treatment","has severe weight loss, weakness, fatigue, cough and fever, and frequent infections, skin rashes and diarrhea. ",0.5815900900000004,0.4055435,0.742605503
Early HIV without anemia,Generic uncomplicated disease: anxiety about diagnosis,has a disease diagnosis that causes some worry but minimal interference with daily activities.,0.012440830799999992,0.006194748,0.022708943
Early HIV with mild anemia,"Anemia, mild; Generic uncomplicated disease anxiety",,0.016083330724259114,0.007595395,0.030998712879199503
Early HIV with moderate anemia,"Anemia, moderate; Generic uncomplicated disease anxiety",,0.063305862,0.039980345,0.094802634
Early HIV with severe anemia,"Anemia, severe; Generic uncomplicated disease anxiety",,0.15932514528591096,0.10850395436709401,0.22044928265000246
Symptomatic HIV with mild anemia,"HIV cases, symptomatic, pre-AIDS and anemia, mild",(combined DW),0.27718121817781244,0.1885033008323565,0.37914754894346925
Symptomatic HIV with moderate anemia,"HIV cases, symptomatic, pre-AIDS and anemia, moderate",(combined DW),0.3115853185096714,0.21665628873092116,0.4180340236232527
Symptomatic HIV with severe anemia,"HIV cases, symptomatic, pre-AIDS and anemia, severe",(combined DW),0.3811476240504045,0.26857990585767555,0.504582025
AIDS with mild anemia,"AIDS cases, not receiving ARV treatment and anemia, mild",(combined DW),0.5832162669649755,0.4091747382174809,0.7429764700391112
AIDS with moderate anemia,"AIDS cases, not receiving ARV treatment and anemia, moderate",(combined DW),0.6029126095246116,0.43024704008973896,0.7583127356256133
AIDS with severe anemia,"AIDS cases, not receiving ARV treatment and anemia, severe",(combined DW),0.6420190504532072,0.470049634,0.7921600937296155
HIV/AIDS with antiretroviral treatment without anemia,"HIV/AIDS cases, receiving ARV treatment",has occasional fevers and infections. The person takes daily medication that sometimes causes diarrhea.,0.078017329,0.05212429,0.11106665749999999
HIV/AIDS with antiretroviral treatment with mild anemia,"HIV/AIDS cases, receiving ARV treatment and anemia, mild",(combined DW),0.081413316,0.054154643,0.11574105735539648
HIV/AIDS with antiretroviral treatment with moderate anemia,"HIV/AIDS cases, receiving ARV treatment and anemia, moderate",(combined DW),0.12539263604668588,0.084764614,0.176414503
HIV/AIDS with antiretroviral treatment with severe anemia,"HIV/AIDS cases, receiving ARV treatment and anemia, severe",(combined DW),0.2148186327019286,0.1481110574670234,0.29504815013240815
Asymptomatic congenital syphilis ,Asymptomatic,,0,0,0
"Early symptomatic congenital syphilis, infectious syndrome","Infectious disease, acute episode, moderate ","has a fever and aches, and feels weak, which causes some difficulty with daily activities. ",0.050594946,0.032378223,0.07405045
"Late symptomatic congenital syphilis, neurosyphilis","Motor plus cognitive impairments, moderate","has some difficulty in moving around, holding objects, dressing and sitting upright, but can walk without help. The person has low intelligence and is slow in learning to speak and to do simple tasks.",0.20294601350000027,0.13394816,0.28958335
"Early symptomatic congenital syphilis, slight disfigurement","Disfigurement, level 1","has a slight, visible physical deformity that others notice, which causes some worry and discomfort.",0.011016252399999999,0.005239763,0.020619542499999997
"Late symptomatic congenital syphilis, slight disfigurement","Disfigurement, level 1","has a slight, visible physical deformity that others notice, which causes some worry and discomfort.",0.011016252399999999,0.005239763,0.020619542499999997
"Late symptomatic congenital syphilis, unilateral hearing loss","Hearing loss, unilateral","can hear well with one ear but has hearing loss in the other ear, resulting in some trouble following a conversation in a noisy environment",0.007986165,0.00359251,0.015490782500000001
Asymptomatic early syphilis infection,Asymptomatic,,0,0,0
Mild early syphilis infection,"Infectious disease, acute episode, mild","has a low fever and mild discomfort , but no difficulty with daily activities.",0.005786497,0.00229985,0.012109072499999998
Asymptomatic adult tertiary syphilis,Asymptomatic,,0,0,0
Cardiovascular complications due to adult tertiary syphilis,"Infectious disease, acute episode, moderate ","has a fever and aches, and feels weak, which causes some difficulty with daily activities. ",0.050594946,0.032378223,0.07405045
Severe disfigurement due to adult tertiary syphilis,"Disfigurement, level 3","has an obvious physical deformity that makes others uncomfortable, which causes the person to avoid social contact, feel worried, sleep poorly, and think about suicide.",0.40479053700000034,0.274506378,0.545533435
Neurological problems due to adult tertiary syphilis,"Motor plus cognitive impairments, moderate","has some difficulty in moving around, holding objects, dressing and sitting upright, but can walk without help. The person has low intelligence and is slow in learning to speak and to do simple tasks.",0.20294601350000027,0.13394816,0.28958335
Neurological problems and cardiovascular complications due to adult tertiary syphilis,"Moderate motor plus cognitive impairments and moderate infectious disease, acute episode",(combined DW),0.24302714956393123,0.16800283090605625,0.33310621849768146
Severe disfigurement and cardiovascular complications due to adult tertiary syphilis,"Level 3 disfigurement and moderate infectious disease, acute episode",(combined DW),0.4346225717020275,0.30565248458631794,0.5713169658249093
Severe disfigurement and neurological problems due to adult tertiary syphilis,Level 3 disfigurement and moderate motor plus cognitive impairments,(combined DW),0.5232097489835387,0.378418767,0.669377133
"Severe disfigurement, neurological problems, and cardiovascular complications due to adult tertiary syphilis","Level 3 disfigurement, moderate motor plus cognitive impairments, and moderate infectious disease, acute episode",(combined DW),0.5469659490102426,0.4020574875608513,0.690747392
Asymptomatic chlamydial infection,Asymptomatic,,0,0,0
Mild chlamydial infection,"Infectious disease, acute episode, mild","has a low fever and mild discomfort , but no difficulty with daily activities.",0.005786497,0.00229985,0.012109072499999998
Epididymo-orchitis due to chlamydial infection,Epididymo-orchitis,has swelling and tenderness in the testicles and pain during urination. ,0.1281245327999997,0.086099005,0.18045061999999998
Primary infertility due to chlamydial infection,"Infertility, primary","wants to have a child and has a fertile partner, but the couple cannot conceive.",0.007564045,0.003335558,0.015242128
Secondary infertility due to chlamydial infection,"Infertility, secondary","has at least one child, and wants to have more children. The person has a fertile partner, but the couple cannot conceive. ",0.005145153,0.002002058,0.011025222499999997
Moderate pelvic inflammatory diseases due to chlamydial infection,"Abdominopelvic problem, moderate",has pain in the belly and feels nauseous. The person has difficulties with daily activities. ,0.11433996700000003,0.077947085,0.158676813
Severe pelvic inflammatory diseases due to chlamydial infection,"Abdominopelvic problem, severe",has severe pain in the belly and feels nauseous. The person is anxious and unable to carry out daily activities.,0.3242465507999999,0.219721318,0.44180474000000003
Asymptomatic gonococcal infection,Asymptomatic,,0,0,0
Mild gonococcal infection,"Infectious disease, acute episode, mild","has a low fever and mild discomfort , but no difficulty with daily activities.",0.005786497,0.00229985,0.012109072499999998
Epididymo-orchitis due to gonococcal infection,Epididymo-orchitis,has swelling and tenderness in the testicles and pain during urination. ,0.1281245327999997,0.086099005,0.18045061999999998
Primary infertility due to gonococcal infection,"Infertility, primary","wants to have a child and has a fertile partner, but the couple cannot conceive.",0.007564045,0.003335558,0.015242128
Secondary infertility due to gonococcal infection,"Infertility, secondary","has at least one child, and wants to have more children. The person has a fertile partner, but the couple cannot conceive. ",0.005145153,0.002002058,0.011025222499999997
Moderate pelvic inflammatory diseases due to gonococcal infection,"Abdominopelvic problem, moderate",has pain in the belly and feels nauseous. The person has difficulties with daily activities. ,0.11433996700000003,0.077947085,0.158676813
Severe pelvic inflammatory diseases due to gonococcal infection,"Abdominopelvic problem, severe",has severe pain in the belly and feels nauseous. The person is anxious and unable to carry out daily activities.,0.3242465507999999,0.219721318,0.44180474000000003
Asymptomatic trichomoniasis infection,Asymptomatic,,0,0,0
Acute trichomoniasis infection,"Infectious disease, acute episode, mild","has a low fever and mild discomfort , but no difficulty with daily activities.",0.005786497,0.00229985,0.012109072499999998
Asymptomatic herpes simplex virus-2 infection,Asymptomatic,,0,0,0
Recurrent symptomatic episode of genital herpes,"Infectious disease, acute episode, mild","has a low fever and mild discomfort , but no difficulty with daily activities.",0.005786497,0.00229985,0.012109072499999998
Initial symptomatic episode of genital herpes,"Infectious disease, acute episode, moderate ","has a fever and aches, and feels weak, which causes some difficulty with daily activities. ",0.050594946,0.032378223,0.07405045
Primary infertility due to other sexually transmitted diseases,"Infertility, primary","wants to have a child and has a fertile partner, but the couple cannot conceive.",0.007564045,0.003335558,0.015242128
Secondary infertility due to other sexually transmitted diseases,"Infertility, secondary","has at least one child, and wants to have more children. The person has a fertile partner, but the couple cannot conceive. ",0.005145153,0.002002058,0.011025222499999997
Moderate pelvic inflammatory diseases due to other sexually transmitted diseases,"Abdominopelvic problem, moderate",has pain in the belly and feels nauseous. The person has difficulties with daily activities. ,0.11433996700000003,0.077947085,0.158676813
Severe pelvic inflammatory diseases due to other sexually transmitted diseases,"Abdominopelvic problem, severe",has severe pain in the belly and feels nauseous. The person is anxious and unable to carry out daily activities.,0.3242465507999999,0.219721318,0.44180474000000003
Other sexually transmitted diseases residual,"Post-COMO calculation for residuals (YLL/YLD ratio, other methods)",,,,
Latent tuberculosis infection,Asymptomatic,,0,0,0
Drug-susceptible tuberculosis,"Tuberculosis, not HIV infected","has a persistent cough and fever, is short of breath, feels weak, and has lost a lot of weight.",0.332620658,0.223629598,0.453926995
Multidrug-resistant tuberculosis without extensive drug resistance ,"Tuberculosis, not HIV infected","has a persistent cough and fever, is short of breath, feels weak, and has lost a lot of weight.",0.332620658,0.223629598,0.453926995
Extensively drug-resistant tuberculosis,"Tuberculosis, not HIV infected","has a persistent cough and fever, is short of breath, feels weak, and has lost a lot of weight.",0.332620658,0.223629598,0.453926995
Guillain-Barré syndrome due to lower respiratory infections,Spinal cord lesion below neck level (treated),"is paralyzed from the waist down, cannot feel or move the legs and has difficulties with urine and bowel control. The person uses a wheelchair to move around.",0.2961648466999997,0.19813263,0.41379709
Moderate lower respiratory infections,"Infectious disease, acute episode, moderate ","has a fever and aches, and feels weak, which causes some difficulty with daily activities. ",0.050594946,0.032378223,0.07405045
Severe lower respiratory infections,"Infectious disease, acute episode, severe","has a high fever and pain, and feels very weak, which causes great difficulty with daily activities.",0.133411519,0.088459515,0.189501665
Guillain-Barré syndrome due to upper respiratory infections,Spinal cord lesion below neck level (treated),"is paralyzed from the waist down, cannot feel or move the legs and has difficulties with urine and bowel control. The person uses a wheelchair to move around.",0.2961648466999997,0.19813263,0.41379709
Mild upper respiratory infections,"Infectious disease, acute episode, mild","has a low fever and mild discomfort , but no difficulty with daily activities.",0.005786497,0.00229985,0.012109072499999998
Moderate upper respiratory infections,"Infectious disease, acute episode, moderate ","has a fever and aches, and feels weak, which causes some difficulty with daily activities. ",0.050594946,0.032378223,0.07405045
Acute otitis media,Ear pain,has an ear-ache that causes some difficulty with daily activities.,0.013319973499999997,0.006878043,0.023644419999999996
Severe infectious complications due to chronic otitis media,"Infectious disease, acute episode, severe","has a high fever and pain, and feels very weak, which causes great difficulty with daily activities.",0.133411519,0.088459515,0.189501665
Mild hearing loss due to chronic otitis media,"Hearing loss, mild","has great difficulty hearing and understanding another person talking in a noisy place (for example, on an urban street).",0.009557887,0.00419248,0.0188052
Moderate hearing loss due to chronic otitis media,"Hearing loss, moderate","is unable to hear and understand another person talking in a noisy place (for example, on an urban street), and has difficulty hearing another person talking even in a quiet place or on the phone.",0.026575171199999952,0.015295117500000002,0.042228913
Mild hearing loss with ringing due to chronic otitis media,"Hearing loss, mild, with ringing","has great difficulty hearing and understanding another person talking in a noisy place (for example, on an urban street), and sometimes has annoying ringing in the ears.",0.021431429,0.011755785,0.036158027
Moderate hearing loss with ringing due to chronic otitis media,"Hearing loss, moderate, with ringing","is unable to hear and understand another person talking in a noisy place (for example, on an urban street), and has difficulty hearing another person talking even in a quiet place or on the phone, and has annoying ringing in the ears for more than 5 minutes at a time, almost everyday.",0.073963036,0.048560812499999995,0.106579533
Vertigo with mild hearing loss due to chronic otitis media,Vertigo with mild hearing loss,,0.1218160654611371,0.079220649,0.17025245226115296
Vertigo with moderate hearing loss due to chronic otitis media,Vertigo with moderate hearing loss,,0.13683932136787366,0.089131899,0.18871289714104847
Vertigo with mild hearing loss and ringing due to chronic otitis media,Vertigo with mild hearing loss and ringing,,0.1323015733699122,0.086466799,0.18372988181483188
Vertigo with moderate hearing loss and ringing due to chronic otitis media,Vertigo with moderate hearing loss and ringing,,0.17866646028935337,0.12034716,0.24689385199373282
Guillain-Barré syndrome due to diarrheal diseases,Spinal cord lesion below neck level (treated),"is paralyzed from the waist down, cannot feel or move the legs and has difficulties with urine and bowel control. The person uses a wheelchair to move around.",0.2961648466999997,0.19813263,0.41379709
Mild diarrheal diseases,"Diarrhea, mild",has diarrhea three or more times a day with occasional discomfort in the belly.,0.073536964,0.0487335,0.104392015
Moderate diarrheal diseases,"Diarrhea, moderate","has diarrhea three or more times a day, with painful cramps in the belly and feeling thirsty",0.18787419850000006,0.12484303,0.26416233
Severe diarrheal diseases,"Diarrhea, severe",has diarrhea three or more times a day with severe belly cramps. The person is very thirsty and feels nauseous and tired. ,0.24709577250000017,0.164043595,0.347775068
Gastrointestinal bleeding due to typhoid,Gastric bleeding,vomits blood and feels nauseous.,0.3248039414999996,0.20924532499999998,0.462166763
Intestinal perforation due to typhoid,"Abdominopelvic problem, severe",has severe pain in the belly and feels nauseous. The person is anxious and unable to carry out daily activities.,0.3242465507999999,0.219721318,0.44180474000000003
Acute typhoid infection,"Infectious disease, acute episode, moderate ","has a fever and aches, and feels weak, which causes some difficulty with daily activities. ",0.050594946,0.032378223,0.07405045
Severe typhoid fever,"Infectious disease, acute episode, severe","has a high fever and pain, and feels very weak, which causes great difficulty with daily activities.",0.133411519,0.088459515,0.189501665
Intestinal perforation due to paratyphoid,"Abdominopelvic problem, moderate",has pain in the belly and feels nauseous. The person has difficulties with daily activities. ,0.11433996700000003,0.077947085,0.158676813
Acute paratyphoid infection,"Infectious disease, acute episode, mild","has a low fever and mild discomfort , but no difficulty with daily activities.",0.005786497,0.00229985,0.012109072499999998
Moderate paratyphoid fever,"Infectious disease, acute episode, moderate ","has a fever and aches, and feels weak, which causes some difficulty with daily activities. ",0.050594946,0.032378223,0.07405045
Severe paratyphoid fever,"Infectious disease, acute episode, severe","has a high fever and pain, and feels very weak, which causes great difficulty with daily activities.",0.133411519,0.088459515,0.189501665
Severe acute iNTS,"Infectious disease, acute episode, severe","has a high fever and pain, and feels very weak, which causes great difficulty with daily activities.",0.133411519,0.088459515,0.189501665
Other intestinal infectious diseases,"Post-COMO calculation for residuals (YLL/YLD ratio, other methods)",,,,
Mild malaria,"Infectious disease, acute episode, mild","has a low fever and mild discomfort , but no difficulty with daily activities.",0.005786497,0.00229985,0.012109072499999998
Mild malaria with mild anemia,"Infectious disease, acute episode, mild, with mild anemia",(combined DW),0.009456459,0.003737965,0.019990375
Mild malaria with moderate anemia,"Infectious disease, acute episode, mild, with moderate anemia",(combined DW),0.057010904,0.036645644,0.085295881
Mild malaria with severe anemia,"Infectious disease, acute episode, mild, with severe anemia",(combined DW),0.15368270742169057,0.1050009762129789,0.21399375001701576
Moderate malaria,"Infectious disease, acute episode, moderate ","has a fever and aches, and feels weak, which causes some difficulty with daily activities. ",0.050594946,0.032378223,0.07405045
Moderate malaria with mild anemia,"Infectious disease, acute episode, moderate, with mild anemia",(combined DW),0.054091277,0.033975601,0.079322085
Moderate malaria with moderate anemia,"Infectious disease, acute episode, moderate, with moderate anemia",(combined DW),0.099421231,0.064835668,0.14205088137793373
Moderate malaria with severe anemia,"Infectious disease, acute episode, moderate, with severe anemia",(combined DW),0.1916201982464891,0.1328842561171029,0.262601199
Severe malaria,"Infectious disease, acute episode, severe","has a high fever and pain, and feels very weak, which causes great difficulty with daily activities.",0.133411519,0.088459515,0.189501665
Severe malaria with mild anemia,"Infectious disease, acute episode, severe, with mild anemia",(combined DW),0.1366087295088589,0.091457382,0.19248815000493388
Severe malaria with moderate anemia,"Infectious disease, acute episode, severe, with moderate anemia",(combined DW),0.17786794671433837,0.12183736967690265,0.2473762072803569
Severe malaria with severe anemia,"Infectious disease, acute episode, severe, with severe anemia",(combined DW),0.26167538066322105,0.18351671591987892,0.35904947510167873
Asymptomatic malaria parasitemia (PfPR),Asymptomatic,,0,0,0
Mild anemia due to malaria parasitemia (PfPR),"Anemia, mild","feels slightly tired and weak at times, but this does not interfere with normal daily activities.",0.003696398,0.001312473,0.008138783
Moderate anemia due to malaria parasitemia (PfPR),"Anemia, moderate","feels moderate fatigue, weakness, and shortness of breath after exercise, making daily activities more difficult.",0.051541961500000025,0.033847375,0.075721813
Severe anemia due to malaria parasitemia (PfPR),"Anemia, severe","feels very weak, tired and short of breath, and has problems with activities that require physical effort or deep concentration.",0.14876615300000026,0.10073293999999999,0.20911520249999996
Asymptomatic malaria vivax (PvPR),Asymptomatic,,0,0,0
Mild anemia due to malaria vivax (PvPR),"Anemia, mild","feels slightly tired and weak at times, but this does not interfere with normal daily activities.",0.003696398,0.001312473,0.008138783
Moderate anemia due to malaria vivax (PvPR),"Anemia, moderate","feels moderate fatigue, weakness, and shortness of breath after exercise, making daily activities more difficult.",0.051541961500000025,0.033847375,0.075721813
Severe anemia due to malaria vivax (PvPR),"Anemia, severe","feels very weak, tired and short of breath, and has problems with activities that require physical effort or deep concentration.",0.14876615300000026,0.10073293999999999,0.20911520249999996
Moderate motor impairment due to malaria,"Motor impairment, moderate","has some difficulty in moving around, and difficulty in lifting and holding objects, dressing and sitting upright, but is able to walk without help.",0.060833859,0.039587362499999994,0.08908513
Moderate motor impairment with blindness due to malaria,Moderate motor impairment with blindness,(combined DW),0.23648531544898732,0.1647713133515859,0.3230759605629558
Moderate motor impairment with epilepsy due to malaria,Moderate motor impairment with epilepsy,(combined DW),,,
Moderate motor impairment with blindness and epilepsy due to malaria,Moderate motor impairment with blindness and epilepsy,(combined DW),,,
Moderate motor impairment with blindness and epilepsy due to malaria,Moderate motor impairment with blindness and epilepsy,(combined DW),,,
Severe motor impairment due to malaria,"Motor impairment, severe","is unable to move around without help, and is not able to lift or hold objects, get dressed or sit upright. ",0.40161053799999963,0.268270568,0.545332718
Severe motor impairment with blindness due to malaria ,Severe motor impairment with blindness,(combined DW),0.5115479696286481,0.3651390306750295,0.6577634013273959
Severe motor impairment with epilepsy due to malaria,Severe motor impairment with epilepsy,(combined DW),,,
Moderate motor plus cognitive impairment with blindness due to malaria,Moderate motor plus cognitive impairment with blindness,(combined DW),0.3510380294473931,0.24521213129145425,0.46739038855932424
Moderate motor plus cognitive impairment with blindness due to malaria,Moderate motor plus cognitive impairment with blindness,(combined DW),0.3510380294473931,0.24521213129145425,0.46739038855932424
